{
  "affected_entity_ids": [
    "ms-opslens-se-start"
  ],
  "changes": [
    {
      "id": "ms-opslens-se-start",
      "kind": "milestone",
      "new": {
        "evidence_ids": [
          "ev-opslens-first-commit-1c795b2"
        ],
        "status": "IN_PROGRESS",
        "summary": "Người học báo cáo đã bắt đầu chương trình Software Engineering trên OpsLens và đã cấu hình SSH, tạo rồi push commit đầu tiên 1c795b2 lên Minhlike/Opslens. AgentTutor chỉ lưu tham chiếu; Agent không truy cập hay xác minh repository OpsLens.",
        "updated_at": "2026-10-27T11:31:23.042030+00:00",
        "verification": "CLAIMED"
      },
      "previous": null
    }
  ],
  "context": {
    "decisions": [],
    "misconceptions": [],
    "next_action": "Hoàn tất hai kiểm thử HEALTHY của Java 02 (300/500 và 500/500), sau đó bắt đầu Java 03 về while.",
    "open_issues": [
      "Java 02: kiểm thử trường hợp HEALTHY 300/500.",
      "Java 02: kiểm thử trường hợp HEALTHY 500/500.",
      "DevOps S56: chờ kết quả Infrastructure Baseline theo baseline đã ghi nhận."
    ],
    "source_timestamp": "2026-10-27T10:01:00+07:00",
    "summary": "Người học báo cáo đã bắt đầu chương trình Software Engineering trên OpsLens và đã cấu hình SSH, tạo rồi push commit đầu tiên 1c795b2 lên Minhlike/Opslens. AgentTutor chỉ lưu tham chiếu; Agent không truy cập hay xác minh repository OpsLens."
  },
  "event_id": "evt-20261027-opslens-se-start-1",
  "evidence": [
    {
      "id": "ev-opslens-first-commit-1c795b2",
      "reference": "https://github.com/Minhlike/Opslens/commit/1c795b2 (commit SHA do người học báo cáo; chưa xác minh)",
      "reported_verification": "CLAIMED",
      "type": "commit"
    }
  ],
  "handoff_id": "ho-20261027-opslens-se-start-1",
  "outcome": "accepted-as-claim",
  "payload_sha256": "b09c1ec1723754cb10d5901683770e9e64b7696fa6e212c46a28e84abcd0ee2b",
  "schema_version": 1,
  "source": "chatgpt-primary-tutor",
  "timestamp": "2026-10-27T11:31:23.042030+00:00",
  "type": "TUTOR_SYNC",
  "verification": "CLAIMED"
}
