{
  "affected_entity_ids": [
    "ms-java-learning",
    "comp-java-01-latency",
    "comp-java-02-scanner-warning",
    "comp-java-03-while"
  ],
  "changes": [
    {
      "id": "ms-java-learning",
      "kind": "milestone",
      "new": {
        "evidence_ids": [],
        "status": "IN_PROGRESS",
        "summary": "Java 01 được người học báo cáo hoàn thành sau khi viết và chạy chương trình kiểm tra độ trễ. Java 02 đã triển khai Scanner, nhập liệu động, xử lý WARNING và chạy UTF-8 thành công; hai trường hợp HEALTHY còn chờ kiểm thử. Java 03 while chưa bắt đầu. Các nội dung chưa được Agent kiểm tra độc lập.",
        "updated_at": "2026-10-27T11:31:22.599915+00:00",
        "verification": "CLAIMED"
      },
      "previous": null
    },
    {
      "id": "comp-java-01-latency",
      "kind": "competency",
      "new": {
        "evidence_ids": [],
        "status": "COMPLETED",
        "summary": "Người học báo cáo đã viết và chạy chương trình kiểm tra độ trễ; chưa có artifact hoặc test được Agent xác minh.",
        "updated_at": "2026-10-27T11:31:22.599915+00:00",
        "verification": "CLAIMED"
      },
      "previous": null
    },
    {
      "id": "comp-java-02-scanner-warning",
      "kind": "competency",
      "new": {
        "evidence_ids": [],
        "status": "IN_PROGRESS",
        "summary": "Người học báo cáo đã triển khai Scanner, nhập liệu động, xử lý WARNING và chạy UTF-8 thành công. Còn kiểm thử HEALTHY với 300/500 và 500/500.",
        "updated_at": "2026-10-27T11:31:22.599915+00:00",
        "verification": "CLAIMED"
      },
      "previous": null
    },
    {
      "id": "comp-java-03-while",
      "kind": "competency",
      "new": {
        "evidence_ids": [],
        "status": "NOT_STARTED",
        "summary": "Chưa bắt đầu theo trạng thái người học cung cấp.",
        "updated_at": "2026-10-27T11:31:22.599915+00:00",
        "verification": "CLAIMED"
      },
      "previous": null
    }
  ],
  "context": {
    "decisions": [],
    "misconceptions": [],
    "next_action": "Hoàn tất hai kiểm thử HEALTHY của Java 02 (300/500 và 500/500), sau đó bắt đầu Java 03 về while.",
    "open_issues": [
      "Java 02: kiểm thử trường hợp HEALTHY 300/500.",
      "Java 02: kiểm thử trường hợp HEALTHY 500/500.",
      "DevOps S56: chờ kết quả Infrastructure Baseline theo baseline đã ghi nhận."
    ],
    "source_timestamp": "2026-10-27T10:00:00+07:00",
    "summary": "Java 01 được người học báo cáo hoàn thành sau khi viết và chạy chương trình kiểm tra độ trễ. Java 02 đã triển khai Scanner, nhập liệu động, xử lý WARNING và chạy UTF-8 thành công; hai trường hợp HEALTHY còn chờ kiểm thử. Java 03 while chưa bắt đầu. Các nội dung chưa được Agent kiểm tra độc lập."
  },
  "event_id": "evt-20261027-java-progress-1",
  "evidence": [],
  "handoff_id": "ho-20261027-java-progress-1",
  "outcome": "accepted-as-claim",
  "payload_sha256": "9e0a60d1eda49d135881fb74ce0280abf0cbba1c1795ce3a8f9bac43a47a6761",
  "schema_version": 1,
  "source": "chatgpt-primary-tutor",
  "timestamp": "2026-10-27T11:31:22.599915+00:00",
  "type": "TUTOR_SYNC",
  "verification": "CLAIMED"
}
