{
  "schema_version": 1,
  "event_id": "evt-20261027-devops-baseline",
  "timestamp": "2026-10-27T00:00:00+07:00",
  "source": "user-master-task",
  "type": "BASELINE",
  "handoff_id": null,
  "payload_sha256": null,
  "affected_entity_ids": ["program-devops", "ms-devops-phase-11", "ms-devops-s56"],
  "changes": [
    {
      "kind": "program", "id": "program-devops", "previous": null,
      "new": {
        "status": "IN_PROGRESS", "verification": "CLAIMED",
        "summary": "Người học báo cáo đã nghiệm thu 55/66 buổi DevOps; Agent chưa kiểm tra bằng chứng lab.",
        "details": {"accepted_sessions": 55, "total_sessions": 66},
        "evidence_ids": [], "updated_at": "2026-10-27T00:00:00+07:00"
      }
    },
    {
      "kind": "milestone", "id": "ms-devops-phase-11", "previous": null,
      "new": {
        "status": "COMPLETED", "verification": "CLAIMED",
        "summary": "Phase 11 đã hoàn thành theo báo cáo của người học; chưa có kiểm tra độc lập trong AgentTutor.",
        "evidence_ids": [], "updated_at": "2026-10-27T00:00:00+07:00"
      }
    },
    {
      "kind": "milestone", "id": "ms-devops-s56", "previous": null,
      "new": {
        "status": "IN_PROGRESS", "verification": "CLAIMED",
        "summary": "S56 đang thực hiện; chờ kết quả Infrastructure Baseline.",
        "evidence_ids": [], "updated_at": "2026-10-27T00:00:00+07:00"
      }
    }
  ],
  "evidence": [],
  "verification": "CLAIMED",
  "outcome": "reported-baseline-recorded",
  "context": {
    "summary": "Baseline DevOps do người học cung cấp: 55/66 buổi đã nghiệm thu, Phase 11 hoàn thành, S56 đang thực hiện. Chưa kiểm tra lab hoặc bằng chứng độc lập.",
    "next_action": "Nhận kết quả Infrastructure Baseline của S56 từ ChatGPT/người học, kèm bằng chứng và tiêu chí nghiệm thu.",
    "open_issues": ["Chưa có kết quả Infrastructure Baseline S56 hoặc liên kết bằng chứng để Agent kiểm tra."],
    "decisions": [], "misconceptions": []
  }
}
